{
  "schema_version": "identity-prime.masking-decision.v1",
  "decision_id": "md_patient_adtech_read_0001",
  "subject_ref": "ce_patient_0042",
  "requesting_realm": "ADTECH",
  "audience": { "role": "ad_audience_builder", "openid_profile_attr": null },
  "requested_op": "read",
  "verdict": "deny",
  "reason_codes": ["FORBIDDEN_IDENTITY_MIXTURE", "NO_HEALTH_ADTECH"],
  "forbidden_mixture": ["patient", "ad_tech"],
  "applied_transforms": [],
  "re_identification": null,
  "side_channel_mitigations": ["policy", "unlinkable_identifiers", "monitoring"],
  "receipt": {
    "policy_decision_ref": "pd_no_health_adtech_0001",
    "beacon_commit_receipt": "beacon:placeholder-health-adtech-deny",
    "certificate_hash": "sha256:masking-health-adtech-deny-placeholder"
  },
  "policy_version": "regis.identity.polytope.core@0.1.0",
  "scheme_version": "identity-prime.tokenization-profile.v1",
  "decided_by": "masking-pdp-agent",
  "created_at": "2026-06-29T15:04:00Z"
}
